{
  "id": "arri_skypanel_x21",
  "name": "ARRI SkyPanel X21",
  "manufacturer": "ARRI",
  "model": "SkyPanel X21",
  "category": "lighting",
  "subcategory": null,
  "asset_level": "digital_twin",
  "source": {
    "primary_type": "official_product_page",
    "primary_url": "https://www.arri.com/service/search/en/49664?pageNum=0&query=dmx",
    "secondary_urls": [],
    "license_review_required": true,
    "notes": ""
  },
  "physical": {
    "dimensions_m": null,
    "weight_kg": null,
    "power_w": null,
    "minimum_height_m": null,
    "maximum_height_m": null
  },
  "lighting": null,
  "geometry": {
    "master_format": "procedural",
    "master_path": null,
    "lods": {
      "lod0": {
        "target_triangles": 60000,
        "path": null
      },
      "lod1": {
        "target_triangles": 20000,
        "path": null
      },
      "lod2": {
        "target_triangles": 5000,
        "path": null
      }
    },
    "materials_max": 10,
    "texture_max_px": 2048,
    "brand_marks_in_runtime": false
  },
  "coordinates": {
    "unit": "meter",
    "up_axis": "+Y",
    "forward_axis": "+Z",
    "root_rule": "device_origin",
    "ground_contact_required": false
  },
  "anchors": [],
  "articulation": [],
  "compatibility": {
    "accepts": [],
    "provides": [],
    "accessories": []
  },
  "verification": {
    "dimensions": "pending",
    "pivot": "pending",
    "anchors": "pending",
    "articulation": "pending",
    "web_load": "pending",
    "thumbnail": "pending",
    "license": "pending"
  }
}