{
  "id": "arri_orbiter",
  "name": "ARRI Orbiter",
  "manufacturer": "ARRI",
  "model": "Orbiter",
  "category": "lighting",
  "subcategory": "led_spotlight",
  "asset_level": "digital_twin",
  "source": {
    "primary_type": "official_cad",
    "primary_url": "https://www.arri.com/service/search/en/49664?query=Arri+Orbiter",
    "secondary_urls": [
      "https://www.arri.com/en/lighting/led-spotlights/orbiter/tech-specs",
      "https://www.arri.com/en/lighting/led-spotlights/orbiter/accessories/optics"
    ],
    "license_review_required": true,
    "notes": "Use official STP as master geometry only after confirming permitted runtime redistribution."
  },
  "physical": {
    "dimensions_m": null,
    "weight_kg": 11.7,
    "power_w": 500,
    "minimum_height_m": null,
    "maximum_height_m": null
  },
  "lighting": {
    "cct_k": [
      2000,
      20000
    ],
    "beam_angle_deg": null,
    "native_beam_angle_deg": 80,
    "photometric_files": [
      "photometric/orbiter_open_face.ies"
    ],
    "gdtf_files": [
      "control/orbiter.gdtf"
    ],
    "emitter_node": "ANCHOR_EMITTER",
    "light_axis_node": "LIGHT_AXIS"
  },
  "geometry": {
    "master_format": "STP",
    "master_path": "master/orbiter.stp",
    "lods": {
      "lod0": {
        "target_triangles": 80000,
        "path": "runtime/lod0.glb"
      },
      "lod1": {
        "target_triangles": 30000,
        "path": "runtime/lod1.glb"
      },
      "lod2": {
        "target_triangles": 8000,
        "path": "runtime/lod2.glb"
      }
    },
    "materials_max": 12,
    "texture_max_px": 2048,
    "brand_marks_in_runtime": false
  },
  "coordinates": {
    "unit": "meter",
    "up_axis": "+Y",
    "forward_axis": "+Z",
    "root_rule": "mount_center",
    "ground_contact_required": false
  },
  "anchors": [
    {
      "name": "MOUNT_STAND",
      "type": "stand_junior_28mm",
      "node": "ANCHOR_MOUNT",
      "position_m": [
        0,
        0,
        0
      ],
      "rotation_deg": [
        0,
        0,
        0
      ]
    },
    {
      "name": "FRONT_OPTIC",
      "type": "arri_qlm",
      "node": "ANCHOR_FRONT",
      "position_m": [
        0,
        0,
        0
      ],
      "rotation_deg": [
        0,
        0,
        0
      ]
    },
    {
      "name": "EMITTER",
      "type": "emitter",
      "node": "ANCHOR_EMITTER",
      "position_m": [
        0,
        0,
        0
      ],
      "rotation_deg": [
        0,
        0,
        0
      ]
    },
    {
      "name": "LIGHT_AXIS",
      "type": "light_axis",
      "node": "LIGHT_AXIS",
      "position_m": [
        0,
        0,
        0
      ],
      "rotation_deg": [
        0,
        0,
        0
      ]
    }
  ],
  "articulation": [
    {
      "node": "YOKE_PAN",
      "kind": "pan",
      "min": -180,
      "max": 180,
      "unit": "degree",
      "default": 0
    },
    {
      "node": "YOKE_TILT",
      "kind": "tilt",
      "min": -90,
      "max": 90,
      "unit": "degree",
      "default": 0
    }
  ],
  "compatibility": {
    "accepts": [
      "stand_junior_28mm"
    ],
    "provides": [
      "arri_qlm"
    ],
    "accessories": [
      "orbiter_open_face_15",
      "orbiter_open_face_30",
      "orbiter_open_face_60",
      "orbiter_projection_25",
      "orbiter_projection_35",
      "orbiter_dome"
    ]
  },
  "verification": {
    "dimensions": "pending",
    "pivot": "pending",
    "anchors": "pending",
    "articulation": "pending",
    "web_load": "pending",
    "thumbnail": "pending",
    "license": "pending"
  }
}